Input,Actual Output,Faithfulness Score,Faithfulness Reason,Relevancy Score,Relevancy Reason
What optimizer was used for training the Transformer?,I don't know. There is no mention of the optimizer used to train the Transformer in the provided text.,0.6666666666666666,"The score is 0.67 because there's a minor discrepancy in that the actual output doesn't directly contradict the retrieval context, which only talks about training cost without mentioning the optimizer.",0.2,"The score is 0.20 because most of the output discussed irrelevant topics such as laptop features and purchase services, which were not relevant to answering the question about the Transformer's optimizer."
How does the attention mechanism calculate the weights?,"The attention mechanism calculates the weights using a compatibility function between the query and the corresponding key. Specifically, it uses the dot-product (multiplicative) attention method, which computes the weight assigned to each value as:

w = QKT / √dk

where w is the weight, Q is the matrix of queries, K is the matrix of keys, T is the transpose of the keys, dk is a scaling factor (which is set to 64 in this case), and V is the matrix of values.",0.6666666666666666,"The score is 0.67 because there's only one slight discrepancy where the actual output doesn't match with 'The claim directly matches the description of dot-product attention' in the retrieval context, indicating some deviation from perfect faithfulness.",0.8,"The score is 0.80 because there are relevant details provided, but also some statements that are too general and don't add new information."
What is the primary advantage of the Transformer model over RNNs?,"The primary advantage of the Transformer model over RNNs is that it allows for significantly more parallelization and can reach a new state-of-the-art in translation quality after being trained for as little as twelve hours on eight P100 GPUs. Additionally, the Transformer generalizes well to other tasks, such as English constituency parsing.",1.0,"The score is 1.00 because there are no discrepancies between the retrieval context and the actual output, indicating perfect alignment.",1.0,"The score is 1.00 because the actual output directly addresses the question about the primary advantage of the Transformer model over RNNs, making it highly relevant and accurate."
